{
  "$schema": "../../../static/schemas/rank.schema.json",
  "title": "Eagle Scout",
  "slug": "eagle",
  "short": "Eagle",
  "level": 7,
  "program": "Scouts BSA",
  "version_id": "108",
  "version_effective_date": "2026-02-27",
  "header": "",
  "footer": "<br><br><strong>NOTES:</strong> <br> For Venturers working on Scouts BSA requirements, replace \"troop\" with \"crew\" and \"Scoutmaster\" with \"crew Advisor.\" For Sea Scouts working on Scouts BSA requirements, replace \"troop\" with \"ship\" and \"Scoutmaster\" with \"Skipper.\" <br><br> <sup>11</sup>Assistant patrol leader and bugler are not approved positions of responsibility for the Eagle Scout rank. Likewise, a Scoutmaster-approved leadership project cannot be used in lieu of serving in a position of responsibility. <br><br> <sup>12</sup> Appeals and Extensions <ul> <li>If a Scout believes all requirements for the Eagle Scout rank have been completed but a board of review is denied, the Scout may request a board of review under disputed circumstances in accordance with Guide to Advancement topic 8.0.3.</li> <li>If the board of review does not approve the Scout's advancement, the decision may be appealed in accordance with Guide to Advancement topic 8.0.4.0.</li> <li>A Scout who foresees that, due to no fault or choice of their own, it will not be possible to complete the Eagle Scout rank requirements before age 18 may apply for a limited time extension in accordance with Guide to Advancement topic 9.0.4.0. These are rarely granted and reserved only for work on Eagle.</li> </ul><br> <sup>13</sup> Age Requirement Eligibility Merit badges and badges of rank may be earned by a registered Scout or a qualified Venturer or Sea Scout. Scouts may earn these awards until their 18th birthday. Any Venturer or Sea Scout who has achieved the First Class rank as a Scout in a troop or as a Lone Scout may continue working up to their 18th birthday toward the Star, Life, and Eagle Scout ranks. <br><br> An Eagle Scout board of review may occur, without special approval, within 24 months after the 18th birthday. Consult the Guide to Advancement topic 8.0.3.1, if a Board of Review is to be conducted more than 24 months after the candidate's 18th birthday. <br><br> If you have a permanent physical or mental disability, or a disability expected to last more than two years or beyond age 18, you may become an Eagle Scout by qualifying for as many required merit badges as you can and qualifying for alternative merit badges for the rest. If you seek to become an Eagle Scout under this procedure, you must submit a special application to your local council service center. Your application must be approved by your council advancement committee before you can work on alternative merit badges. <br><br> A Scout, Venturer, or Sea Scout with a disability may also qualify to work toward rank advancement after reaching 18 years of age if the guidelines outlined in section 10 of the Guide to Advancement are met.",
  "requirements": [
    {
      "req_id": "1",
      "path": "1",
      "text": "Be active in your troop for at least six months as a Life Scout.",
      "list_number": "1",
      "short": "Active 6+ months",
      "months_since_last_rank_required": "6",
      "eagle_mb_required": "",
      "total_mb_required": "",
      "service_hours_required": ""
    },
    {
      "req_id": "2",
      "path": "2",
      "text": "As a Life Scout, demonstrate Scout Spirit by living the Scout Oath and Scout Law. Tell how you have done your duty to God, how you have lived the Scout Oath and Scout Law in your everyday life, and how your understanding of the Scout Oath and Scout Law will guide your life in the future. List on your Eagle Scout Rank Application the names of individuals who know you personally and would be willing to provide a recommendation on your behalf, including parents/guardians, religious (if not affiliated with an organized religion, then the parent or guardian provides this reference), educational, employer (if employed), and two other references.",
      "list_number": "2",
      "short": "Demonstrate Scouting spirit",
      "months_since_last_rank_required": "",
      "eagle_mb_required": "",
      "total_mb_required": "",
      "service_hours_required": ""
    },
    {
      "req_id": "3",
      "path": "3",
      "text": "Earn a total of 21 merit badges (10 more than required for the Life rank), including these 13 merit badges: (a) First Aid, (b) Citizenship in the Community, (c) Citizenship in the Nation, (d) Citizenship in the World, (e) Communication, (f) Cooking, (g) Personal Fitness, (h) Emergency Preparedness OR Lifesaving, (i) Environmental Science OR Sustainability, (j) Personal Management, (k) Swimming OR Hiking OR Cycling, (l) Camping, and (m) Family Life. <br><br> You must choose only one of the merit badges listed in categories h, i, and k. Any additional merit badge(s) earned in those categories may be counted as one of your eight optional merit badges used to make your total of 21.<br><br>",
      "list_number": "3",
      "short": "Earn 21 merit badges",
      "months_since_last_rank_required": "",
      "eagle_mb_required": "13",
      "total_mb_required": "21",
      "service_hours_required": ""
    },
    {
      "req_id": "4",
      "path": "4",
      "text": "While a Life Scout, serve actively in your troop for six months in one or more of the following positions of responsibility<sup>11</sup>:<br><br> <p><strong>Scout troop.</strong> Patrol leader, assistant senior patrol leader, senior patrol leader, troop guide, troop Order of the Arrow representative, den chief, scribe, librarian, historian, quartermaster, junior assistant Scoutmaster, chaplain aide, instructor, webmaster, or outdoor ethics guide.</p> <p><strong>Venturing crew.</strong> President, vice-president, secretary, historian, den chief, treasurer, guide, quartermaster, chaplain aide, or outdoor ethics guide.</p> <p><strong>Sea Scout ship.</strong> Boatswain, boatswains mate, storekeeper, purser, yeoman, crew leader, media specialist, specialist, den chief, or chaplain aide.</p> <p><strong>Lone Scout.</strong> Leadership responsibility in your school, religious organization, club, or elsewhere in your community.</p>",
      "list_number": "4",
      "short": "Position of responsibility",
      "months_since_last_rank_required": "",
      "eagle_mb_required": "",
      "total_mb_required": "",
      "service_hours_required": ""
    },
    {
      "req_id": "5",
      "path": "5",
      "text": "While a Life Scout, plan, develop, and give leadership to others in a service project helpful to any religious institution, any school, or your community. (The project must benefit an organization other than the Boy Scouts of America.) A project proposal must be approved by the organization benefiting from the effort, your Scoutmaster and unit committee, and the council or district before you start. You must use the Eagle Scout Service Project Workbook, BSA publication No. 512-927, in meeting this requirement. (To learn more about the Eagle Scout service project, see the Guide to Advancement, topics 9.0.2.0 through 9.0.2.16.)",
      "list_number": "5",
      "short": "Eagle project",
      "months_since_last_rank_required": "",
      "eagle_mb_required": "",
      "total_mb_required": "",
      "service_hours_required": ""
    },
    {
      "req_id": "6",
      "path": "6",
      "text": "While a Life Scout, participate in a Scoutmaster conference.",
      "list_number": "6",
      "short": "Scoutmaster conference",
      "months_since_last_rank_required": "",
      "eagle_mb_required": "",
      "total_mb_required": "",
      "service_hours_required": ""
    },
    {
      "req_id": "7",
      "path": "7",
      "text": "Successfully complete your board of review for the Eagle Scout rank.<sup>12</sup> <br><br> In preparation for your board of review, prepare and attach to your Eagle Scout Rank Application a statement of your ambitions and life purpose and a listing of positions held in your religious institution, school, camp, community, or other organizations, during which you demonstrated leadership skills. Include honors and awards received during this service. (This requirement may be met after age 18, in accordance with Guide to Advancement topic 8.0.3.1.<sup>13</sup>)",
      "list_number": "7",
      "short": "Board of review",
      "months_since_last_rank_required": "6",
      "eagle_mb_required": "",
      "total_mb_required": "",
      "service_hours_required": ""
    }
  ]
}
