{
  "$schema": "../../../static/schemas/rank.schema.json",
  "title": "Life Scout",
  "slug": "life",
  "short": "Life",
  "level": 6,
  "program": "Scouts BSA",
  "version_id": "41",
  "version_effective_date": "2016-01-01",
  "header": "",
  "footer": "<br><br><strong>NOTES:</strong> For Venturers working on Scouts BSA requirements, replace \"troop\" with \"crew\" and \"Scoutmaster\" with \"crew Advisor.\" For Sea Scouts working on Scouts BSA requirements, replace \"troop\" with \"ship\" and \"Scoutmaster\" with \"Skipper.\" <br><br> <sup>9</sup> Assistant patrol leader is not an approved position of responsibility for the Star, Life, or Eagle rank. <br><br> <sup>10</sup> If the board of review does not approve the Scout's advancement, the decision may be appealed in accordance with Guide to Advancement topic 8.0.4.0.",
  "requirements": [
    {
      "req_id": "1",
      "path": "1",
      "text": "Be active in your troop for at least six months as a Star Scout.",
      "list_number": "1.",
      "short": "Be active 6 months",
      "months_since_last_rank_required": "6",
      "eagle_mb_required": "",
      "total_mb_required": "",
      "service_hours_required": ""
    },
    {
      "req_id": "2",
      "path": "2",
      "text": "As a Star Scout, demonstrate Scout spirit by living the Scout Oath and Scout Law. Tell how you have done your duty to God and how you have lived the Scout Oath and Scout Law in your everyday life.",
      "list_number": "2.",
      "short": "Demonstrate Scout spirit",
      "months_since_last_rank_required": "",
      "eagle_mb_required": "",
      "total_mb_required": "",
      "service_hours_required": ""
    },
    {
      "req_id": "3",
      "path": "3",
      "text": "Earn five more merit badges (so that you have 11 in all) including any number more from the list for Eagle so that you have a total of seven from the required list of Eagle in that total number of 11 merit badges. You may choose any of the 17 merit badges on the required list for Eagle to fulfill this requirement. See Eagle rank requirement 3 for this list.*",
      "list_number": "3.",
      "short": "Earn 5 more merit badges",
      "months_since_last_rank_required": "",
      "eagle_mb_required": "3",
      "total_mb_required": "5",
      "service_hours_required": ""
    },
    {
      "req_id": "4",
      "path": "4",
      "text": "While a Star Scout, participate in six hours of service through one or more service projects approved by your Scoutmaster. At least three hours of this service must be conservation-related.",
      "list_number": "4.",
      "short": "Complete 6 hours of service",
      "months_since_last_rank_required": "",
      "eagle_mb_required": "",
      "total_mb_required": "",
      "service_hours_required": ""
    },
    {
      "req_id": "5",
      "path": "5",
      "text": "While a Star Scout, serve actively in your troop for six months in one or more of the following positions of responsibility (or carry out a Scoutmaster-approved leadership project to help the troop:<br><br> <p><strong>Scout troop.</strong> Patrol leader, assistant senior patrol leader, senior patrol leader, troop guide, Order of the Arrow troop representative, den chief, scribe, librarian, historian, quartermaster, bugler, junior assistant Scoutmaster, chaplain aide, instructor, webmaster, or outdoor ethics guide.<sup>9</sup></p> <p><strong>Venturing crew.</strong> President, vice president, secretary, treasurer, den chief, historian, guide, quartermaster, chaplain aide, or outdoor ethics guide.</p> <p><strong>Sea Scout ship.</strong> Boatswain, boatswain's mate, purser, yeoman, storekeeper, crew leader, media specialist, specialist, den chief, or chaplain aide.</p> <p><strong>Lone Scout.</strong> Leadership responsibility in your school, religious organization, club, or elsewhere in your community.</p>",
      "list_number": "5.",
      "short": "Serve in position of responsibility",
      "months_since_last_rank_required": "",
      "eagle_mb_required": "",
      "total_mb_required": "",
      "service_hours_required": ""
    },
    {
      "req_id": "6",
      "path": "6",
      "text": "While a Star Scout, use the Teaching EDGE method to teach another Scout (preferably younger than you) the skills from ONE of the following choices, so that the Scout is prepared to pass those requirements to their Scoutmaster's satisfaction. <ol> <li>Tenderfoot 4a and 4b (first aid)</li> <li>Second Class 2b, 2c, and 2d (cooking/tools)</li> <li>Second Class 3a and 3d (navigation)</li> <li>First Class 3a, 3b, 3c, and 3d (tools)</li> <li>First Class 4a and 4b (navigation)</li> <li> Second Class 6a and 6b (first aid)</li> <li>First Class - 7a and 7b (first aid)</li> <li>Three requirements from one of the required for Eagle merit badges, as approved by your Scoutmaster</li> </ol>",
      "list_number": "6.",
      "short": "Teach a Scout using EDGE",
      "months_since_last_rank_required": "",
      "eagle_mb_required": "",
      "total_mb_required": "",
      "service_hours_required": ""
    },
    {
      "req_id": "7",
      "path": "7",
      "text": "While a Star Scout, participate in a Scoutmaster conference.",
      "list_number": "7.",
      "short": "Complete Scoutmaster conference",
      "months_since_last_rank_required": "",
      "eagle_mb_required": "",
      "total_mb_required": "",
      "service_hours_required": ""
    },
    {
      "req_id": "8",
      "path": "8",
      "text": "Successfully complete your board of review for the Life rank.*<br> <br> *If the board of review does not approve the Scout's advancement, the decision may be appealed in accordance with <em>Guide to Advancement</em> topic 8.0.4.0.",
      "list_number": "8.",
      "short": "Complete board of review",
      "months_since_last_rank_required": "6",
      "eagle_mb_required": "",
      "total_mb_required": "",
      "service_hours_required": ""
    }
  ]
}
